Authors,Author full names,Author(s) ID,Title,Year,Source title,Volume,Issue,Art. No.,Page start,Page end,Cited by,DOI,Link,Document Type,doi_norm,title_norm,venue_type_inferred,matched_venue_name,matched_by,venue_match_score,venue_classification,selection_status,selection_reason,,,,
Jia H.; He S.; Ding Y.,"Jia, Hanguang (57206662754); He, Shilie (57215323018); Ding, Yaiqong (60544698700)",57206662754; 57215323018; 60544698700,High-Accuracy MOSFET Modeling and Characterization Using Neural Networks with Automated SPICE Model Conversion,2025,"Proceedings of 2025 IEEE International Conference on Sensing, Diagnostics, Prognostics, and Control, SDPC 2025",,,,58,62,0,10.1109/SDPC68151.2025.11347616,https://www.scopus.com/inward/record.uri?eid=2-s2.0-105034272109&doi=10.1109%2FSDPC68151.2025.11347616&partnerID=40&md5=0c4029486ed422c796de3955f975275e,Conference paper,10.1109/sdpc68151.2025.11347616,high accuracy mosfet modeling and characterization using neural networks with automated spice model conversion,conference,,,0,,unclassified,conference_venue_not_matched,,,excluded,No reliable venue mapping found in ranking sources after normalization/alias pass
Idreos S.,"Idreos, Stratos (6507423234)",6507423234,"Alphabets, Grammars, Calculators, and the End of Hand-Crafted Systems",2025,Proceedings of the VLDB Endowment,18,12,,5537,,0,10.14778/3750601.3760522,https://www.scopus.com/inward/record.uri?eid=2-s2.0-105016523305&doi=10.14778%2F3750601.3760522&partnerID=40&md5=8097e449866d4674209215a0801e3b5f,Conference paper,10.14778/3750601.3760522,alphabets grammars calculators and the end of hand crafted systems,conference,,,0,,unclassified,conference_venue_not_matched,,,excluded,No reliable venue mapping found in ranking sources after normalization/alias pass
Moreira I.; Braganca L.; Silva O.; Silva A.; Ferreira R.S.; Nacif J.A.M.,"Moreira, Icaro (57283290500); Braganca, Lucas (57205661909); Silva, Olavo (58766320900); Silva, Alysson (58766382500); Ferreira, Ricardo S. (35556989700); Nacif, Jose Augusto M. (8302967700)",57283290500; 57205661909; 58766320900; 58766382500; 35556989700; 8302967700,Bridging the Gap: Accelerating Random Forests on FPGAs with High-Bandwidth Memory,2025,"2025 IEEE 16th Latin American Symposium on Circuits and Systems, LASCAS 2025 - Proceedings",,,,,,2,10.1109/LASCAS64004.2025.10966278,https://www.scopus.com/inward/record.uri?eid=2-s2.0-105004553869&doi=10.1109%2FLASCAS64004.2025.10966278&partnerID=40&md5=e5012386e1b10fa9e9c86868d45aed06,Conference paper,10.1109/lascas64004.2025.10966278,bridging the gap accelerating random forests on fpgas with high bandwidth memory,conference,,,0,,unclassified,conference_venue_not_matched,,,excluded,No reliable venue mapping found in ranking sources after normalization/alias pass
Shaojun Feng; Jiaqing Zhong; Juan Chen,Shaojun Feng; Jiaqing Zhong; Juan Chen,,Using the Internet of Everything for Machine-Learning-Based Computer System Design and Optimization,2025,Internet of Everything,,,,,,,10.1007/978-3-031-84426-3_6,https://link.springer.com/chapter/10.1007/978-3-031-84426-3_6,Conference Paper,10.1007/978-3-031-84426-3_6,using the internet of everything for machine learning based computer system design and optimization,conference,,,0,,unclassified,conference_venue_not_matched,,,excluded,No reliable venue mapping found in ranking sources after normalization/alias pass
Azzedine El mrabet; Ayoub Tber; Rachida Elmousaid; Laamari Hlou; Rachid El gouri,Azzedine El mrabet; Ayoub Tber; Rachida Elmousaid; Laamari Hlou; Rachid El gouri,,Tiny Machine Learning for IoT-Enabled Embedded Systems: A Review,2025,Intelligent Systems and Advanced Computing Sciences,,,,,,,10.1007/978-3-031-93448-3_6,https://link.springer.com/chapter/10.1007/978-3-031-93448-3_6,Conference Paper,10.1007/978-3-031-93448-3_6,tiny machine learning for iot enabled embedded systems a review,conference,,,0,,unclassified,conference_venue_not_matched,,,excluded,No reliable venue mapping found in ranking sources after normalization/alias pass
Renuka KuntalaK. Venkata Balamurali Krishna; Peddi Niranjan Reddy; Mruthyunjayam Allakonda; Gujjula Anjareddy; Bimmarolu Shanthi,Renuka KuntalaK. Venkata Balamurali Krishna; Peddi Niranjan Reddy; Mruthyunjayam Allakonda; Gujjula Anjareddy; Bimmarolu Shanthi,,Automated RTL-To-GDS Flow Optimization Through Machine Learning in VLSI Design,2025,"Proceedings of the Third International Conference on Cognitive and Intelligent Computing, Volume 2",,,,,,,10.1007/978-981-97-9266-5_54,https://link.springer.com/chapter/10.1007/978-981-97-9266-5_54,Conference Paper,10.1007/978-981-97-9266-5_54,automated rtl to gds flow optimization through machine learning in vlsi design,conference,,,0,,unclassified,conference_venue_not_matched,,,excluded,No reliable venue mapping found in ranking sources after normalization/alias pass
Luca Lazzaroni; Ali Dabbous; Matteo Nardello; Muath Abu Lebdeh; Riccardo Berta; Kasim Sinan Yildirim; Francesco Bellotti; Davide Brunelli,Luca Lazzaroni; Ali Dabbous; Matteo Nardello; Muath Abu Lebdeh; Riccardo Berta; Kasim Sinan Yildirim; Francesco Bellotti; Davide Brunelli,,Green Machine Learning for the IoT (GEMINI): A Position Paper,2025,"Applications in Electronics Pervading Industry, Environment and Society",,,,,,,10.1007/978-3-031-84100-2_40,https://link.springer.com/chapter/10.1007/978-3-031-84100-2_40,Conference Paper,10.1007/978-3-031-84100-2_40,green machine learning for the iot gemini a position paper,conference,,,0,,unclassified,conference_venue_not_matched,,,excluded,No reliable venue mapping found in ranking sources after normalization/alias pass
Qian Jin; Qingsong Peng; Yumeng Liu; Xiaotian Qiu; Qi Sun,Qian Jin; Qingsong Peng; Yumeng Liu; Xiaotian Qiu; Qi Sun,,Recent advances in computational lithography technology,2025,Moore and More,,,,,,,10.1007/s44275-025-00032-5,https://link.springer.com/article/10.1007/s44275-025-00032-5,Journal Article,10.1007/s44275-025-00032-5,recent advances in computational lithography technology,journal,,,0,,unclassified,journal_venue_not_matched,,,excluded,No reliable venue mapping found in ranking sources after normalization/alias pass
Kamal Sehairi; Mohammed Redha Bouzidi; Thierry Bouwmans,Kamal Sehairi; Mohammed Redha Bouzidi; Thierry Bouwmans,,Accelerating 4K Morphological Image Operations on PYNQ-Z1 and Kria KV260 FPGA Boards Using the Vitis Vision Library,2025,"Intelligent Systems, Blockchain, and Communication Technologies",,,,,,,10.1007/978-3-032-09562-6_1,https://link.springer.com/chapter/10.1007/978-3-032-09562-6_1,Conference Paper,10.1007/978-3-032-09562-6_1,accelerating 4k morphological image operations on pynq z1 and kria kv260 fpga boards using the vitis vision library,conference,,,0,,unclassified,conference_venue_not_matched,,,excluded,No reliable venue mapping found in ranking sources after normalization/alias pass
Partha Pratim Ray,Partha Pratim Ray,,"Physical AI: bridging the sim-to-real divide toward embodied, ethical, and autonomous intelligence",2025,Machine Learning for Computational Science and Engineering,,,,,,,10.1007/s44379-025-00050-y,https://link.springer.com/article/10.1007/s44379-025-00050-y,Journal Article,10.1007/s44379-025-00050-y,physical ai bridging the sim to real divide toward embodied ethical and autonomous intelligence,journal,,,0,,unclassified,journal_venue_not_matched,,,excluded,No reliable venue mapping found in ranking sources after normalization/alias pass
Naima El-Amarty; Chaimae Chekira; Hakim El Fadili; Saad Dosse Bennani,Naima El-Amarty; Chaimae Chekira; Hakim El Fadili; Saad Dosse Bennani,,Solar Energy Forecasting Using TinyML Techniques: A Comprehensive Survey,2025,Proceedings of the 4th International Conference on Advances in Communication Technology and Computer Engineering (ICACTCE’24),,,,,,,10.1007/978-3-031-94623-3_33,https://link.springer.com/chapter/10.1007/978-3-031-94623-3_33,Conference Paper,10.1007/978-3-031-94623-3_33,solar energy forecasting using tinyml techniques a comprehensive survey,conference,,,0,,unclassified,conference_venue_not_matched,,,excluded,No reliable venue mapping found in ranking sources after normalization/alias pass
M. SaibodalovM. DashievI. KarandashevN. ZheludkovE. Kocheva,M. SaibodalovM. DashievI. KarandashevN. ZheludkovE. Kocheva,,Neural Networks-Based Routing Congestion Prediction Using Initial Layout Parameters,2025,Optical Memory and Neural Networks,,,,,,,10.3103/S1060992X25601538,https://link.springer.com/article/10.3103/S1060992X25601538,Journal Article,10.3103/s1060992x25601538,neural networks based routing congestion prediction using initial layout parameters,journal,,,0,,unclassified,journal_venue_not_matched,,,excluded,No reliable venue mapping found in ranking sources after normalization/alias pass
Aditi Kumari; Ankita Mondal; Aditi Kumari; Tribeni Prasad Banerjee,Aditi Kumari; Ankita Mondal; Aditi Kumari; Tribeni Prasad Banerjee,,Area Efficient Lightweight Cipher System Implementation for Edge Device,2025,Bio-Inspired Computing,,,,,,,10.1007/978-3-031-78949-6_12,https://link.springer.com/chapter/10.1007/978-3-031-78949-6_12,Conference Paper,10.1007/978-3-031-78949-6_12,area efficient lightweight cipher system implementation for edge device,conference,,,0,,unclassified,conference_venue_not_matched,,,excluded,No reliable venue mapping found in ranking sources after normalization/alias pass
Sriram Prabhakara Rao; Shree Ram Abayankar Balaji; Farishta Rahman; Tasneem Suha; Tanzim Mahfuz; Tanvir Hossain; Mahmudul Hasan; Md Sakib Hasan; Tamzidul Hoque; Prabuddha Chakraborty; Prakash Ranganathan,Sriram Prabhakara Rao; Shree Ram Abayankar Balaji; Farishta Rahman; Tasneem Suha; Tanzim Mahfuz; Tanvir Hossain; Mahmudul Hasan; Md Sakib Hasan; Tamzidul Hoque; Prabuddha Chakraborty; Prakash Ranganathan,,"Secure and Trustworthy Microelectronics: Vulnerabilities, Solutions, and Trends",2025,Journal of Hardware and Systems Security,,,,,,,10.1007/s41635-025-00165-x,https://link.springer.com/article/10.1007/s41635-025-00165-x,Journal Article,10.1007/s41635-025-00165-x,secure and trustworthy microelectronics vulnerabilities solutions and trends,journal,,,0,,unclassified,journal_venue_not_matched,,,excluded,No reliable venue mapping found in ranking sources after normalization/alias pass
Manuel de Castro; Roberto R. Osorio; Francisco J. Andújar; Rocío Carratalá-Sáez; Yuri Torres; Diego R. Llanos,Manuel de Castro; Roberto R. Osorio; Francisco J. Andújar; Rocío Carratalá-Sáez; Yuri Torres; Diego R. Llanos,,Challenging Portability Paradigms: FPGA Acceleration Using SYCL and OpenCL,2025,Euro-Par 2024: Parallel Processing Workshops,,,,,,,10.1007/978-3-031-90200-0_33,https://link.springer.com/chapter/10.1007/978-3-031-90200-0_33,Conference Paper,10.1007/978-3-031-90200-0_33,challenging portability paradigms fpga acceleration using sycl and opencl,conference,,,0,,unclassified,conference_venue_not_matched,,,excluded,No reliable venue mapping found in ranking sources after normalization/alias pass
Joy Acharya; Paawan Sharma; Mohendra Roy,Joy Acharya; Paawan Sharma; Mohendra Roy,,"Optimized RC-PUF Design for IoT Security: Evaluation of the Impact of ADC Bit Selection and Time Delay on Uniqueness, Reliability, and Statistical Randomness",2025,Journal of Hardware and Systems Security,,,,,,,10.1007/s41635-025-00169-7,https://link.springer.com/article/10.1007/s41635-025-00169-7,Journal Article,10.1007/s41635-025-00169-7,optimized rc puf design for iot security evaluation of the impact of adc bit selection and time delay on uniqueness reliability and statistical randomness,journal,,,0,,unclassified,journal_venue_not_matched,,,excluded,No reliable venue mapping found in ranking sources after normalization/alias pass
Md Kawser Bepary; Tao Zhang; Jingbo Zhou; Fahim Rahman; Farimah Farahmandi; Mark Tehranipoor,Md Kawser Bepary; Tao Zhang; Jingbo Zhou; Fahim Rahman; Farimah Farahmandi; Mark Tehranipoor,,Towards Efficient Gate-Level Electromagnetic Side-Channel Leakage Modeling and Vulnerability Assessment,2025,Journal of Hardware and Systems Security,,,,,,,10.1007/s41635-025-00161-1,https://link.springer.com/article/10.1007/s41635-025-00161-1,Journal Article,10.1007/s41635-025-00161-1,towards efficient gate level electromagnetic side channel leakage modeling and vulnerability assessment,journal,,,0,,unclassified,journal_venue_not_matched,,,excluded,No reliable venue mapping found in ranking sources after normalization/alias pass
Bai Y.; Sohrabizadeh A.; Ding Z.; Liang R.; Li W.; Wang D.; Ren H.; Sun Y.; Cong J.,Yunsheng Bai; Atefeh Sohrabizadeh; Zijian Ding; Rongjian Liang; Weikai Li; Ding Wang; Haoxing Ren; Yizhou Sun; Jason Cong,,Learning to Compare Hardware Designs for High-Level Synthesis,2024,Proceedings of the 2024 ACM/IEEE International Symposium on Machine Learning for CAD,,,2,,,,10.1145/3670474.3685940,https://doi.org/10.1145/3670474.3685940,Conference Paper,10.1145/3670474.3685940,learning to compare hardware designs for high level synthesis,conference,,,0,,unclassified,conference_venue_not_matched,,,excluded,No reliable venue mapping found in ranking sources after normalization/alias pass
Ren J.,Jiachen Ren,,A Systematic Analysis of Data Diversity in Machine Learning for EDA,2024,Proceedings of the 6th International Conference on Information Technologies and Electrical Engineering,,,,283,287,,10.1145/3640115.3640160,https://doi.org/10.1145/3640115.3640160,Conference Paper,10.1145/3640115.3640160,a systematic analysis of data diversity in machine learning for eda,conference,,,0,,unclassified,conference_venue_not_matched,,,excluded,No reliable venue mapping found in ranking sources after normalization/alias pass
Qin Z.; Bai Y.; Sohrabizadeh A.; Ding Z.; Hu Z.; Sun Y.; Cong J.,Zongyue Qin; Yunsheng Bai; Atefeh Sohrabizadeh; Zijian Ding; Ziniu Hu; Yizhou Sun; Jason Cong,,Cross-Modality Program Representation Learning for Electronic Design Automation with High-Level Synthesis,2024,Proceedings of the 2024 ACM/IEEE International Symposium on Machine Learning for CAD,,,14,,,,10.1145/3670474.3685952,https://doi.org/10.1145/3670474.3685952,Conference Paper,10.1145/3670474.3685952,cross modality program representation learning for electronic design automation with high level synthesis,conference,,,0,,unclassified,conference_venue_not_matched,,,excluded,No reliable venue mapping found in ranking sources after normalization/alias pass
Abi-Karam S.; Sarkar R.; Seigler A.; Lowe S.; Wei Z.; Chen H.; Rao N.; John L.; Arora A.; Hao C.,Stefan Abi-Karam; Rishov Sarkar; Allison Seigler; Sean Lowe; Zhigang Wei; Hanqiu Chen; Nanditha Rao; Lizy John; Aman Arora; Cong Hao,,HLSFactory: A Framework Empowering High-Level Synthesis Datasets for Machine Learning and Beyond,2024,Proceedings of the 2024 ACM/IEEE International Symposium on Machine Learning for CAD,,,23,,,,10.1145/3670474.3685961,https://doi.org/10.1145/3670474.3685961,Conference Paper,10.1145/3670474.3685961,hlsfactory a framework empowering high level synthesis datasets for machine learning and beyond,conference,,,0,,unclassified,conference_venue_not_matched,,,excluded,No reliable venue mapping found in ranking sources after normalization/alias pass
Ahmadifarsani S.; Stahl R.; Kempen P.v.; Mueller-Gritschneder D.; Schlichtmann U.,Samira Ahmadifarsani; Rafael Stahl; Philipp van Kempen; Daniel Mueller-Gritschneder; Ulf Schlichtmann,,Towards Rapid Exploration of Heterogeneous TinyML Systems using Virtual Platforms and TVM's UMA,2024,"Proceedings of the 2023 Workshop on Compilers, Deployment, and Tooling for Edge AI",,,,6,10,,10.1145/3615338.3618121,https://doi.org/10.1145/3615338.3618121,Conference Paper,10.1145/3615338.3618121,towards rapid exploration of heterogeneous tinyml systems using virtual platforms and tvm s uma,conference,,,0,,unclassified,conference_venue_not_matched,,,excluded,No reliable venue mapping found in ranking sources after normalization/alias pass
Gao S.; Qiu K.,Shiyu Gao; Keni Qiu,,An ML-aided Approach to Automatically Generate Schematic Symbols in PCB EDA Tools,2024,Proceedings of the 2024 ACM/IEEE International Symposium on Machine Learning for CAD,,,6,,,,10.1145/3670474.3685944,https://doi.org/10.1145/3670474.3685944,Conference Paper,10.1145/3670474.3685944,an ml aided approach to automatically generate schematic symbols in pcb eda tools,conference,,,0,,unclassified,conference_venue_not_matched,,,excluded,No reliable venue mapping found in ranking sources after normalization/alias pass
Feng H.; Zhang B.; Ye F.; Si M.; Chu C.; Tian J.; Yin C.; Deng S.; Hao Y.; Balaji P.; Geng T.; Tao D.,Hao Feng; Boyuan Zhang; Fanjiang Ye; Min Si; Ching-Hsiang Chu; Jiannan Tian; Chunxing Yin; Summer Deng; Yuchen Hao; Pavan Balaji; Tong Geng; Dingwen Tao,,Accelerating Communication in Deep Learning Recommendation Model Training with Dual-Level Adaptive Lossy Compression,2024,"Proceedings of the International Conference for High Performance Computing, Networking, Storage, and Analysis",,,89,,,,10.1109/SC41406.2024.00095,https://doi.org/10.1109/SC41406.2024.00095,Conference Paper,10.1109/sc41406.2024.00095,accelerating communication in deep learning recommendation model training with dual level adaptive lossy compression,conference,,,0,,unclassified,conference_venue_not_matched,,,excluded,No reliable venue mapping found in ranking sources after normalization/alias pass
An W.; Bi X.; Chen G.; Chen S.; Deng C.; Ding H.; Dong K.; Du Q.; Gao W.; Guan K.; Guo J.; Guo Y.; Fu Z.; He Y.; Huang P.; Li J.; Liang W.; Liu X.; Liu X.; Liu Y.; Liu Y.; Lu S.; Lu X.; Nie X.; Pei T.; Qiu J.; Qu H.; Ren Z.; Sha Z.; Su X.; Sun X.; Tan Y.; Tang M.; Wang S.; Wang Y.; Wang Y.; Xie Z.; Xiong Y.; Xu Y.; Ye S.; Yu S.; Zha Y.; Zhang L.; Zhang H.; Zhang M.; Zhang W.; Zhang Y.; Zhao C.; Zhao Y.; Zhou S.; Zhou S.; Zou Y.,Wei An; Xiao Bi; Guanting Chen; Shanhuang Chen; Chengqi Deng; Honghui Ding; Kai Dong; Qiushi Du; Wenjun Gao; Kang Guan; Jianzhong Guo; Yongqiang Guo; Zhe Fu; Ying He; Panpan Huang; Jiashi Li; Wenfeng Liang; Xiaodong Liu; Xin Liu; Yiyuan Liu; Yuxuan Liu; Shanghao Lu; Xuan Lu; Xiaotao Nie; Tian Pei; Junjie Qiu; Hui Qu; Zehui Ren; Zhangli Sha; Xuecheng Su; Xiaowen Sun; Yixuan Tan; Minghui Tang; Shiyu Wang; Yaohui Wang; Yongji Wang; Ziwei Xie; Yiliang Xiong; Yanhong Xu; Shengfeng Ye; Shuiping Yu; Yukun Zha; Liyue Zhang; Haowei Zhang; Mingchuan Zhang; Wentao Zhang; Yichao Zhang; Chenggang Zhao; Yao Zhao; Shangyan Zhou; Shunfeng Zhou; Yuheng Zou,,Fire-Flyer AI-HPC: A Cost-Effective Software-Hardware Co-Design for Deep Learning,2024,"Proceedings of the International Conference for High Performance Computing, Networking, Storage, and Analysis",,,83,,,,10.1109/SC41406.2024.00089,https://doi.org/10.1109/SC41406.2024.00089,Conference Paper,10.1109/sc41406.2024.00089,fire flyer ai hpc a cost effective software hardware co design for deep learning,conference,,,0,,unclassified,conference_venue_not_matched,,,excluded,No reliable venue mapping found in ranking sources after normalization/alias pass
Peccia F.N.; Bringmann O.,Federico Nicolas Peccia; Oliver Bringmann,,Integration of a systolic array based hardware accelerator into a DNN operator auto-tuning framework,2024,"Proceedings of the 2023 Workshop on Compilers, Deployment, and Tooling for Edge AI",,,,21,26,,10.1145/3615338.3618130,https://doi.org/10.1145/3615338.3618130,Conference Paper,10.1145/3615338.3618130,integration of a systolic array based hardware accelerator into a dnn operator auto tuning framework,conference,,,0,,unclassified,conference_venue_not_matched,,,excluded,No reliable venue mapping found in ranking sources after normalization/alias pass
Antici F.; Bartolini A.; Kiziltan Z.; Babaoglu O.; Kodama Y.,Francesco Antici; Andrea Bartolini; Zeynep Kiziltan; Ozalp Babaoglu; Yuetsu Kodama,,MCBound: An Online Framework to Characterize and Classify Memory/Compute-bound HPC Jobs,2024,"Proceedings of the International Conference for High Performance Computing, Networking, Storage, and Analysis",,,56,,,,10.1109/SC41406.2024.00062,https://doi.org/10.1109/SC41406.2024.00062,Conference Paper,10.1109/sc41406.2024.00062,mcbound an online framework to characterize and classify memory compute bound hpc jobs,conference,,,0,,unclassified,conference_venue_not_matched,,,excluded,No reliable venue mapping found in ranking sources after normalization/alias pass
Roman-Vicharra C.; Chen Y.; Hu J.,Cristhian Roman-Vicharra; Yiran Chen; Jiang Hu,,Flip-Flop Centric Incremental Placement for Simultaneous Timing and Clock Network Power Optimization,2024,Proceedings of the 2024 ACM/IEEE International Symposium on Machine Learning for CAD,,,11,,,,10.1145/3670474.3685949,https://doi.org/10.1145/3670474.3685949,Conference Paper,10.1145/3670474.3685949,flip flop centric incremental placement for simultaneous timing and clock network power optimization,conference,,,0,,unclassified,conference_venue_not_matched,,,excluded,No reliable venue mapping found in ranking sources after normalization/alias pass
Zhang Y.; Xiao K.; Wang S.; Zhou J.,Yanlong Zhang; Ke Xiao; Shuo Wang; Jing Zhou,,Integration of a Trojan Detection Tool with BFDS: Enhancing Field-Programmable Gate Array Security,2024,"Proceedings of the 2024 4th International Conference on Artificial Intelligence, Automation and Algorithms",,,,27,33,,10.1145/3700523.3700530,https://doi.org/10.1145/3700523.3700530,Conference Paper,10.1145/3700523.3700530,integration of a trojan detection tool with bfds enhancing field programmable gate array security,conference,,,0,,unclassified,conference_venue_not_matched,,,excluded,No reliable venue mapping found in ranking sources after normalization/alias pass
Sharma U.; Wu B.; Kankipati S.R.D.; Chhabria V.A.; Rovinski A.,Utsav Sharma; Bing-Yue Wu; Sai Rahul Dhanvi Kankipati; Vidya A. Chhabria; Austin Rovinski,,OpenROAD-Assistant: An Open-Source Large Language Model for Physical Design Tasks,2024,Proceedings of the 2024 ACM/IEEE International Symposium on Machine Learning for CAD,,,22,,,,10.1145/3670474.3685960,https://doi.org/10.1145/3670474.3685960,Conference Paper,10.1145/3670474.3685960,openroad assistant an open source large language model for physical design tasks,conference,,,0,,unclassified,conference_venue_not_matched,,,excluded,No reliable venue mapping found in ranking sources after normalization/alias pass
Francisco L.; Arikati S.,Luis Francisco; Srini Arikati,,LLM Based Physical Verification Runset Generator,2024,Proceedings of the 2024 ACM/IEEE International Symposium on Machine Learning for CAD,,,35,,,,10.1145/3670474.3685976,https://doi.org/10.1145/3670474.3685976,Conference Paper,10.1145/3670474.3685976,llm based physical verification runset generator,conference,,,0,,unclassified,conference_venue_not_matched,,,excluded,No reliable venue mapping found in ranking sources after normalization/alias pass
Louage M.; Iqbal M.M.; Stroobandt D.,Marieke Louage; Muhammad Mazher Iqbal; Dirk Stroobandt,,On the Interconnection Complexity vs Size Trade-off in Circuit Graphs,2024,Proceedings of the 2023 ACM International Workshop on System-Level Interconnect Pathfinding,,,1,,,,10.1145/3632409.3632838,https://doi.org/10.1145/3632409.3632838,Conference Paper,10.1145/3632409.3632838,on the interconnection complexity vs size trade off in circuit graphs,conference,,,0,,unclassified,conference_venue_not_matched,,,excluded,No reliable venue mapping found in ranking sources after normalization/alias pass
Vijayaraghavan P.; Nitsure A.; Mackin C.; Shi L.; Ambrogio S.; Haran A.; Paruthi V.; Elzein A.; Coops D.; Beymer D.; Baldwin T.; Degan E.,Prashanth Vijayaraghavan; Apoorva Nitsure; Charles Mackin; Luyao Shi; Stefano Ambrogio; Arvind Haran; Viresh Paruthi; Ali Elzein; Dan Coops; David Beymer; Tyler Baldwin; Ehsan Degan,,Chain-of-Descriptions: Improving Code LLMs for VHDL Code Generation and Summarization,2024,Proceedings of the 2024 ACM/IEEE International Symposium on Machine Learning for CAD,,,28,,,,10.1145/3670474.3685966,https://doi.org/10.1145/3670474.3685966,Conference Paper,10.1145/3670474.3685966,chain of descriptions improving code llms for vhdl code generation and summarization,conference,,,0,,unclassified,conference_venue_not_matched,,,excluded,No reliable venue mapping found in ranking sources after normalization/alias pass
Fu V.; Zaourar L.; Munier-Kordon A.; Duranton M.,Vincent Fu; Lilia Zaourar; Alix Munier-Kordon; Marc Duranton,,Design Space Exploration of HPC Systems with Random Forest-based Bayesian Optimization,2024,Proceedings of the 16th Workshop on Rapid Simulation and Performance Evaluation for Design,,,,9,15,,10.1145/3642921.3642923,https://doi.org/10.1145/3642921.3642923,Conference Paper,10.1145/3642921.3642923,design space exploration of hpc systems with random forest based bayesian optimization,conference,,,0,,unclassified,conference_venue_not_matched,,,excluded,No reliable venue mapping found in ranking sources after normalization/alias pass
Zhang X.; Zhang Z.,Xin Zhang; Zhenwu Zhang,,An improved multidimensional high-parallelism pulsation array,2024,Proceedings of the 2023 6th International Conference on Artificial Intelligence and Pattern Recognition,,,,832,840,,10.1145/3641584.3641708,https://doi.org/10.1145/3641584.3641708,Conference Paper,10.1145/3641584.3641708,an improved multidimensional high parallelism pulsation array,conference,,,0,,unclassified,conference_venue_not_matched,,,excluded,No reliable venue mapping found in ranking sources after normalization/alias pass
