Authors,Author full names,Author(s) ID,Title,Year,Source title,Volume,Issue,Art. No.,Page start,Page end,Cited by,DOI,Link,Document Type,doi_norm,title_norm,venue_type_inferred,matched_venue_name,matched_by,venue_match_score,venue_classification,selection_status,selection_reason,,,,
A. AbhivandhanaK. Mariammal,A. AbhivandhanaK. Mariammal,,Optimizing Convolutional Neural Network for Accurate Digit Recognition,2026,Advanced Computing and Intelligent Technologies,,,,,,,10.1007/978-981-96-4933-4_51,https://link.springer.com/chapter/10.1007/978-981-96-4933-4_51,Conference Paper,10.1007/978-981-96-4933-4_51,optimizing convolutional neural network for accurate digit recognition,conference,,,0,,unclassified,conference_venue_not_matched,,,excluded,No reliable venue mapping found in ranking sources after normalization/alias pass
Martin Flasskamp; Christian Klarhorst; Jens Hagemeyer,Martin Flasskamp; Christian Klarhorst; Jens Hagemeyer,,Comparison of Hardware Component and Manycore Implementation for Anomaly Detection in Trustworthy System-on-Chips,2026,Advances in Computational Intelligence,,,,,,,10.1007/978-3-032-02725-2_17,https://link.springer.com/chapter/10.1007/978-3-032-02725-2_17,Conference Paper,10.1007/978-3-032-02725-2_17,comparison of hardware component and manycore implementation for anomaly detection in trustworthy system on chips,conference,,,0,,unclassified,conference_venue_not_matched,,,excluded,No reliable venue mapping found in ranking sources after normalization/alias pass
Domenic Drechsel; Stefan Henkler; Sheikh Muhammad Adib Bin Sh Abu Bakar; Kathleen Strodick; Lukas Walter; Kristian Rother; Ali Ehteshami Bejnordi,Domenic Drechsel; Stefan Henkler; Sheikh Muhammad Adib Bin Sh Abu Bakar; Kathleen Strodick; Lukas Walter; Kristian Rother; Ali Ehteshami Bejnordi,,Hardware Acceleration of CNNs with the FINN Framework,2026,"Architecting the Future: Intelligent Systems for Embedded AI, Autonomous Technologies, and Digital Twins",,,,,,,10.1007/978-3-032-07102-6_5,https://link.springer.com/chapter/10.1007/978-3-032-07102-6_5,Conference Paper,10.1007/978-3-032-07102-6_5,hardware acceleration of cnns with the finn framework,conference,,,0,,unclassified,conference_venue_not_matched,,,excluded,No reliable venue mapping found in ranking sources after normalization/alias pass
Nikita Zheludkov,Nikita Zheludkov,,Neural Network Methods for Wirelength Estimation at the Placement Stage,2026,"Advances in Neural Computation, Machine Learning, and Cognitive Research IX",,,,,,,10.1007/978-3-032-07690-8_36,https://link.springer.com/chapter/10.1007/978-3-032-07690-8_36,Conference Paper,10.1007/978-3-032-07690-8_36,neural network methods for wirelength estimation at the placement stage,conference,,,0,,unclassified,conference_venue_not_matched,,,excluded,No reliable venue mapping found in ranking sources after normalization/alias pass
Hao Wang; Bin Lan; Bangguo Wei; Xiangyang Chen; Chao Guo,Hao Wang; Bin Lan; Bangguo Wei; Xiangyang Chen; Chao Guo,,Optimization and Acceleration of Visual-Inertial Navigation System for UAVs Based on Heterogeneous Computing Architecture,2026,Proceedings of 2025 Chinese Intelligent Automation Conference,,,,,,,10.1007/978-981-95-4053-2_48,https://link.springer.com/chapter/10.1007/978-981-95-4053-2_48,Conference Paper,10.1007/978-981-95-4053-2_48,optimization and acceleration of visual inertial navigation system for uavs based on heterogeneous computing architecture,conference,,,0,,unclassified,conference_venue_not_matched,,,excluded,No reliable venue mapping found in ranking sources after normalization/alias pass
Sumesh Manjunath Ramesh; Hoda Alkhzaimi,Sumesh Manjunath Ramesh; Hoda Alkhzaimi,,TPL: Power Leakage Model Based on Technology Library,2026,Progress in Cryptology - AFRICACRYPT 2025,,,,,,,10.1007/978-3-031-97260-7_14,https://link.springer.com/chapter/10.1007/978-3-031-97260-7_14,Conference Paper,10.1007/978-3-031-97260-7_14,tpl power leakage model based on technology library,conference,,,0,,unclassified,conference_venue_not_matched,,,excluded,No reliable venue mapping found in ranking sources after normalization/alias pass
Eda Marchetti; Anikó Costa; Sanaz Nikghadam-Hojjati; José Barata; Antonello Calabrò,Eda Marchetti; Anikó Costa; Sanaz Nikghadam-Hojjati; José Barata; Antonello Calabrò,,Toward Cybersecure-by-Design Manufacturing Systems: A Taxonomy of Hardware-Based Approaches for Software Cybersecurity Violation Detection,2026,Innovative Intelligent Industrial Production and Logistics,,,,,,,10.1007/978-3-032-15576-4_24,https://link.springer.com/chapter/10.1007/978-3-032-15576-4_24,Conference Paper,10.1007/978-3-032-15576-4_24,toward cybersecure by design manufacturing systems a taxonomy of hardware based approaches for software cybersecurity violation detection,conference,,,0,,unclassified,conference_venue_not_matched,,,excluded,No reliable venue mapping found in ranking sources after normalization/alias pass
Ang J.A.; Tumeo A.; Agostini N.B.; Limaye A.,James Alfred Ang; Antonino Tumeo; Nícolas Bohm Agostini; Ankur Limaye,,The U.S. Microelectronics Research Programs and Where They Lower Barriers to Co-Design. Invited Paper,2025,Proceedings of the 22nd ACM International Conference on Computing Frontiers: Workshops and Special Sessions,,,,135,139,,10.1145/3706594.3732236,https://doi.org/10.1145/3706594.3732236,Conference Paper,10.1145/3706594.3732236,the u s microelectronics research programs and where they lower barriers to co design invited paper,conference,,,0,,unclassified,conference_venue_not_matched,,,excluded,No reliable venue mapping found in ranking sources after normalization/alias pass
Pamnani C.R.,Chintan Rajesh Pamnani,,AI-Driven Automation for Digital Hardware Design: A Multi-Agent Generative Approach,2025,Proceedings of the 2025 4th International Conference on Frontiers of Artificial Intelligence and Machine Learning,,,,26,30,,10.1145/3748382.3748388,https://doi.org/10.1145/3748382.3748388,Conference Paper,10.1145/3748382.3748388,ai driven automation for digital hardware design a multi agent generative approach,conference,,,0,,unclassified,conference_venue_not_matched,,,excluded,No reliable venue mapping found in ranking sources after normalization/alias pass
Chen X.; Goldner A.; Yildiz E.; Mandel I.; Cheng T.; Hester J.; Gupta U.,Xuesi Chen; Ariel Goldner; Eren Yildiz; Ilan Mandel; Tingyu Cheng; Josiah Hester; Udit Gupta,,From Component to System: Rethinking Edge Computing Design through a Carbon-Aware Lens,2025,SIGENERGY Energy Inform. Rev.,5,2,,125,131,,10.1145/3757892.3757910,https://doi.org/10.1145/3757892.3757910,Journal Article,10.1145/3757892.3757910,from component to system rethinking edge computing design through a carbon aware lens,journal,,,0,,unclassified,journal_venue_not_matched,,,excluded,No reliable venue mapping found in ranking sources after normalization/alias pass
Li C.; Bled C.; Fernandez R.; Shanker S.,Changhong Li; Clément Bled; Rosa Fernandez; Shreejith Shanker,,ReTiDe: Real-Time Denoising for Energy-Efficient Motion Picture Processing with FPGAs,2025,Proceedings of the 22nd ACM SIGGRAPH European Conference on Visual Media Production,,,3,,,,10.1145/3756863.3769710,https://doi.org/10.1145/3756863.3769710,Conference Paper,10.1145/3756863.3769710,retide real time denoising for energy efficient motion picture processing with fpgas,conference,,,0,,unclassified,conference_venue_not_matched,,,excluded,No reliable venue mapping found in ranking sources after normalization/alias pass
Berto F.; Hua C.; Park J.; Luttmann L.; Ma Y.; Bu F.; Wang J.; Ye H.; Kim M.; Choi S.; Zepeda N.G.; Hottung A.; Zhou J.; Bi J.; Hu Y.; Liu F.; Kim H.; Son J.; Kim H.; Angioni D.; Kool W.; Cao Z.; Zhang Q.; Kim J.; Zhang J.; Shin K.; Wu C.; Ahn S.; Song G.; Kwon C.; Tierney K.; Xie L.; Park J.,Federico Berto; Chuanbo Hua; Junyoung Park; Laurin Luttmann; Yining Ma; Fanchen Bu; Jiarui Wang; Haoran Ye; Minsu Kim; Sanghyeok Choi; Nayeli Gast Zepeda; André Hottung; Jianan Zhou; Jieyi Bi; Yu Hu; Fei Liu; Hyeonah Kim; Jiwoo Son; Haeyeon Kim; Davide Angioni; Wouter Kool; Zhiguang Cao; Qingfu Zhang; Joungho Kim; Jie Zhang; Kijung Shin; Cathy Wu; Sungsoo Ahn; Guojie Song; Changhyun Kwon; Kevin Tierney; Lin Xie; Jinkyoo Park,,RL4CO: An Extensive Reinforcement Learning for Combinatorial Optimization Benchmark,2025,Proceedings of the 31st ACM SIGKDD Conference on Knowledge Discovery and Data Mining V.2,,,,5278,5289,,10.1145/3711896.3737433,https://doi.org/10.1145/3711896.3737433,Conference Paper,10.1145/3711896.3737433,rl4co an extensive reinforcement learning for combinatorial optimization benchmark,conference,,,0,,unclassified,conference_venue_not_matched,,,excluded,No reliable venue mapping found in ranking sources after normalization/alias pass
Li L.; Pan H.; Zhang P.; Lv K.; Wang Z.; Wan X.; Zhang D.; Zhong X.; Wei H.; Liu L.; Dai H.; Ning Q.; Wei X.; Zhang S.; Guan H.; Li Z.; Xie G.,Luyang Li; Heng Pan; Pengyi Zhang; Kai Lv; Zilong Wang; Xinchen Wan; Dai Zhang; Xiaolong Zhong; Haoran Wei; Lichao Liu; Huichen Dai; Qingsong Ning; Xin Wei; Shideng Zhang; Hongtao Guan; Zhenyu Li; Gaogang Xie,,Taurus: Towards A High-Performance and Generic Congestion Control Framework for Datacenter Networks,2025,Proc. ACM Netw.,3,CoNEXT4,26,,,,10.1145/3768973,https://doi.org/10.1145/3768973,Journal Article,10.1145/3768973,taurus towards a high performance and generic congestion control framework for datacenter networks,journal,,,0,,unclassified,journal_venue_not_matched,,,excluded,No reliable venue mapping found in ranking sources after normalization/alias pass
Batzolis E.; Karampatzakis D.,Eleftherios Batzolis; Dimitris Karampatzakis,,Accelerating Edge Intelligence: Challenges and Future Directions in Hardware-Driven Machine Learning,2025,Proceedings of the 28th Pan-Hellenic Conference on Progress in Computing and Informatics,,,,168,173,,10.1145/3716554.3716579,https://doi.org/10.1145/3716554.3716579,Conference Paper,10.1145/3716554.3716579,accelerating edge intelligence challenges and future directions in hardware driven machine learning,conference,,,0,,unclassified,conference_venue_not_matched,,,excluded,No reliable venue mapping found in ranking sources after normalization/alias pass
Shi J.; Li S.; Xu Y.; Fu R.; Wang X.; Wu T.,Jinliang Shi; Shigang Li; Youxuan Xu; Rongtian Fu; Xueying Wang; Tong Wu,,FlashSparse: Minimizing Computation Redundancy for Fast Sparse Matrix Multiplications on Tensor Cores,2025,Proceedings of the 30th ACM SIGPLAN Annual Symposium on Principles and Practice of Parallel Programming,,,,312,325,,10.1145/3710848.3710858,https://doi.org/10.1145/3710848.3710858,Conference Paper,10.1145/3710848.3710858,flashsparse minimizing computation redundancy for fast sparse matrix multiplications on tensor cores,conference,,,0,,unclassified,conference_venue_not_matched,,,excluded,No reliable venue mapping found in ranking sources after normalization/alias pass
Zhan N.; Woodcock J.; Wang J.; Chen M.,Naijun Zhan; Jim Woodcock; Ji Wang; Mingshuai Chen,,A Brief History of Formal Methods in China,2025,Form. Asp. Comput.,,,,,,,10.1145/3783996,https://doi.org/10.1145/3783996,Journal Article,10.1145/3783996,a brief history of formal methods in china,journal,,,0,,unclassified,journal_venue_not_matched,Formal Aspects of Computing,,excluded,Mapped journal is not Q1/Q2 in ranking sources
Matinizadeh S.; Mohammadhassani A.; Pacik-Nelson N.; Polykretis I.; Tishbi K.; Kumar S.; Varshika M.L.; Mishra A.K.; Kandasamy N.; Shackleford J.; Gallo E.; Das A.,Shadi Matinizadeh; Arghavan Mohammadhassani; Noah Pacik-Nelson; Ioannis Polykretis; Krupa Tishbi; Suman Kumar; M. L. Varshika; Abhishek Kumar Mishra; Nagarajan Kandasamy; James Shackleford; Eric Gallo; Anup Das,,Neuromorphic Computing for the Masses,2025,Proceedings of the International Conference on Neuromorphic Systems,,,,39,46,,10.1109/ICONS62911.2024.00014,https://doi.org/10.1109/ICONS62911.2024.00014,Conference Paper,10.1109/icons62911.2024.00014,neuromorphic computing for the masses,conference,,,0,,unclassified,conference_venue_not_matched,,,excluded,No reliable venue mapping found in ranking sources after normalization/alias pass
Gan W.; Deng X.; Yue W.; Chen Z.; He A.; Hu J.; Ji C.,Wenhua Gan; Xinzhi Deng; Wentao Yue; Ziyu Chen; Anqing He; Jinyuan Hu; Chongxing Ji,,Deep Learning-Powered Natural Language Interface in Intelligent Pest Extermination Robotics,2025,Proceedings of the 2025 International Symposium on Artificial Intelligence and Computational Social Sciences,,,,269,276,,10.1145/3776759.3776802,https://doi.org/10.1145/3776759.3776802,Conference Paper,10.1145/3776759.3776802,deep learning powered natural language interface in intelligent pest extermination robotics,conference,,,0,,unclassified,conference_venue_not_matched,,,excluded,No reliable venue mapping found in ranking sources after normalization/alias pass
Vitolo P.; Psaltakis G.; Tomlinson M.; Licciardo G.D.; Andreou A.G.,Paola Vitolo; George Psaltakis; Michael Tomlinson; Gian Domenico Licciardo; Andreas G. Andreou,,Natural Language to Verilog: Design of a Recurrent Spiking Neural Network using Large Language Models and ChatGPT,2025,Proceedings of the International Conference on Neuromorphic Systems,,,,110,116,,10.1109/ICONS62911.2024.00024,https://doi.org/10.1109/ICONS62911.2024.00024,Conference Paper,10.1109/icons62911.2024.00024,natural language to verilog design of a recurrent spiking neural network using large language models and chatgpt,conference,,,0,,unclassified,conference_venue_not_matched,,,excluded,No reliable venue mapping found in ranking sources after normalization/alias pass
Sun Z.; Chen H.,Zi Sun; Huiyun Chen,,Design and Implementation of an IoT-Enabled Intelligent Sleep-Aid Eye Mask Based on STM32 Microcontroller,2025,Proceedings of the 2025 3rd International Conference on Internet of Things and Cloud Computing Technology,,,,95,99,,10.1145/3776865.3776882,https://doi.org/10.1145/3776865.3776882,Conference Paper,10.1145/3776865.3776882,design and implementation of an iot enabled intelligent sleep aid eye mask based on stm32 microcontroller,conference,,,0,,unclassified,conference_venue_not_matched,,,excluded,No reliable venue mapping found in ranking sources after normalization/alias pass
Eris F.; McConnell U.; Firtina C.; Mutlu O.,Furkan Eris; Ulysse McConnell; Can Firtina; Onur Mutlu,,RawBench: A Comprehensive Benchmarking Framework for Raw Nanopore Signal Analysis Techniques,2025,"Proceedings of the 16th ACM International Conference on Bioinformatics, Computational Biology, and Health Informatics",,,7,,,,10.1145/3765612.3767302,https://doi.org/10.1145/3765612.3767302,Conference Paper,10.1145/3765612.3767302,rawbench a comprehensive benchmarking framework for raw nanopore signal analysis techniques,conference,,,0,,unclassified,conference_venue_not_matched,,,excluded,No reliable venue mapping found in ranking sources after normalization/alias pass
Hua P.,Peng Hua,,A Real-time Cooperative Optimization System for Photography Parameters Based on SNN Low-Power Margin Calculation,2025,Proceedings of the 2025 International Conference on Generative AI and Digital Media Arts,,,,298,305,,10.1145/3770445.3770496,https://doi.org/10.1145/3770445.3770496,Conference Paper,10.1145/3770445.3770496,a real time cooperative optimization system for photography parameters based on snn low power margin calculation,conference,,,0,,unclassified,conference_venue_not_matched,,,excluded,No reliable venue mapping found in ranking sources after normalization/alias pass
Heer M.J.; Ramhorst B.; Alonso G.,Maximilian Jakob Heer; Benjamin Ramhorst; Gustavo Alonso,,Easing the path to deployment in ML4Sys through FPGAs,2025,Proceedings of the 4th Workshop on Practical Adoption Challenges of ML for Systems,,,,56,62,,10.1145/3766882.3767178,https://doi.org/10.1145/3766882.3767178,Conference Paper,10.1145/3766882.3767178,easing the path to deployment in ml4sys through fpgas,conference,,,0,,unclassified,conference_venue_not_matched,,,excluded,No reliable venue mapping found in ranking sources after normalization/alias pass
Guo Z.; Zhang M.; Shan Y.; Chen K.; Jiang J.; Wu Y.,Zhengyan Guo; Mingxing Zhang; Yingdi Shan; Kang Chen; Jinlei Jiang; Yongwei Wu,,Accelerating Stream Processing Engines via Hardware Offloading,2025,Proc. ACM Manag. Data,3,6,289,,,,10.1145/3769754,https://doi.org/10.1145/3769754,Journal Article,10.1145/3769754,accelerating stream processing engines via hardware offloading,journal,,,0,,unclassified,journal_venue_not_matched,Proceedings of the ACM SIGMOD International Conference on Management of Data,,excluded,Mapped journal is not Q1/Q2 in ranking sources
Yue A.; Yew P.; Mehta S.,Anna Yue; Pen-Chung Yew; Sanyam Mehta,,EVeREST: An Effective and Versatile Runtime Energy Saving Tool for GPUs,2025,Proceedings of the 30th ACM SIGPLAN Annual Symposium on Principles and Practice of Parallel Programming,,,,57,69,,10.1145/3710848.3710875,https://doi.org/10.1145/3710848.3710875,Conference Paper,10.1145/3710848.3710875,everest an effective and versatile runtime energy saving tool for gpus,conference,,,0,,unclassified,conference_venue_not_matched,,,excluded,No reliable venue mapping found in ranking sources after normalization/alias pass
Pan C.,Cong Pan,,Real-Time Hardware Architecture Design for An Innovative Bilateral Filtering Algorithm,2025,"Proceedings of the 2025 5th International Conference on Automation Control, Algorithm and Intelligent Bionics",,,,102,107,,10.1145/3760269.3760285,https://doi.org/10.1145/3760269.3760285,Conference Paper,10.1145/3760269.3760285,real time hardware architecture design for an innovative bilateral filtering algorithm,conference,,,0,,unclassified,conference_venue_not_matched,,,excluded,No reliable venue mapping found in ranking sources after normalization/alias pass
Crepalde M.; Mafra A.; Cavalini L.; Martins L.; Amorim G.; Santos P.H.; Peixoto F.,Mirlaine Crepalde; Augusto Mafra; Lucas Cavalini; Lucas Martins; Guilherme Amorim; Pedro Henrique Santos; Fabiano Peixoto,,Automatic Test Case Generation for Jasper App HDL Compiler: An Industry Experience,2025,Proceedings of the 34th ACM SIGPLAN International Conference on Compiler Construction,,,,25,34,,10.1145/3708493.3712681,https://doi.org/10.1145/3708493.3712681,Conference Paper,10.1145/3708493.3712681,automatic test case generation for jasper app hdl compiler an industry experience,conference,,,0,,unclassified,conference_venue_not_matched,,,excluded,No reliable venue mapping found in ranking sources after normalization/alias pass
He W.; Liu H.; Duan Z.; Liao X.; Zhang S.; Mao F.; Jin H.,Weidong He; Haikun Liu; Zhuohui Duan; Xiaofei Liao; Shuhao Zhang; Fubing Mao; Hai Jin,,StraGCN: GPU-Accelerated Strassen’s Sparse-Dense Matrix Multiplication for Graph Convolutional Network Training,2025,"Proceedings of the International Conference for High Performance Computing, Networking, Storage and Analysis",,,,631,644,,10.1145/3712285.3759826,https://doi.org/10.1145/3712285.3759826,Conference Paper,10.1145/3712285.3759826,stragcn gpu accelerated strassen s sparse dense matrix multiplication for graph convolutional network training,conference,,,0,,unclassified,conference_venue_not_matched,,,excluded,No reliable venue mapping found in ranking sources after normalization/alias pass
Hou Y.; Guo L.; Zhou C.; Zhang Q.; Liu W.; Sun C.; Jiang Y.,Yiwei Hou; Lihua Guo; Chijin Zhou; Quan Zhang; Wenhuan Liu; Chengnian Sun; Yu Jiang,,Preventing Disruption of System Backup against Ransomware Attacks,2025,Proc. ACM Softw. Eng.,2,ISSTA,ISSTA011,,,,10.1145/3728880,https://doi.org/10.1145/3728880,Journal Article,10.1145/3728880,preventing disruption of system backup against ransomware attacks,journal,,,0,,unclassified,journal_venue_not_matched,,,excluded,No reliable venue mapping found in ranking sources after normalization/alias pass
Hao J.; Li Y.; Bai H.; Dong X.; Wang H.; Xiao Y.,Jiakai Hao; Yuting Li; Haoyang Bai; Xu Dong; Han Wang; Yitao Xiao,,DPU-Enhanced Network Security Situation Awareness Model for New Power Systems,2025,"Proceedings of the 2024 3rd International Conference on Algorithms, Data Mining, and Information Technology",,,,294,299,,10.1145/3701100.3701161,https://doi.org/10.1145/3701100.3701161,Conference Paper,10.1145/3701100.3701161,dpu enhanced network security situation awareness model for new power systems,conference,,,0,,unclassified,conference_venue_not_matched,,,excluded,No reliable venue mapping found in ranking sources after normalization/alias pass
Zheng H.; Zeng Y.; Song L.; Emani M.; Dong W.,Haoyu Zheng; Yifan Zeng; Linghao Song; Murali Emani; Wenqian Dong,,Enabling Unstructured Sparse Fine-Tuning and Inference for Foundation Models on Wafer-Scale Engine,2025,"Proceedings of the SC '25 Workshops of the International Conference for High Performance Computing, Networking, Storage and Analysis",,,,500,507,,10.1145/3731599.3767395,https://doi.org/10.1145/3731599.3767395,Conference Paper,10.1145/3731599.3767395,enabling unstructured sparse fine tuning and inference for foundation models on wafer scale engine,conference,,,0,,unclassified,conference_venue_not_matched,,,excluded,No reliable venue mapping found in ranking sources after normalization/alias pass
Bednara M.; Braun K.; Kuchlbauer M.; Sigwarth C.,Marcus Bednara; Kristin Braun; Martina Kuchlbauer; Carsten Sigwarth,,Accelerating Linear Programming Performance: A Hardware-Software Co-Design Approach for the Simplex Method,2025,Proceedings of the 15th International Symposium on Highly Efficient Accelerators and Reconfigurable Technologies,,,,156,166,,10.1145/3728179.3728180,https://doi.org/10.1145/3728179.3728180,Conference Paper,10.1145/3728179.3728180,accelerating linear programming performance a hardware software co design approach for the simplex method,conference,,,0,,unclassified,conference_venue_not_matched,,,excluded,No reliable venue mapping found in ranking sources after normalization/alias pass
Lin Y.; Xu Z.; Prasanna V.,Yi-Chien Lin; Zhijie Xu; Viktor Prasanna,,xBS-GNN: Accelerating Billion-Scale GNN Training on FPGA,2025,"Proceedings of the SC '24 Workshops of the International Conference on High Performance Computing, Network, Storage, and Analysis",,,,659,666,,10.1109/SCW63240.2024.00091,https://doi.org/10.1109/SCW63240.2024.00091,Conference Paper,10.1109/scw63240.2024.00091,xbs gnn accelerating billion scale gnn training on fpga,conference,,,0,,unclassified,conference_venue_not_matched,,,excluded,No reliable venue mapping found in ranking sources after normalization/alias pass
Tang E.; Zhang T.; Bradford W.; Siddique F.A.; Hoe J.C.; Skadron K.; Franchetti F.,Eric Tang; Tianyun Zhang; William Bradford; Farzana Ahmed Siddique; James C. Hoe; Kevin Skadron; Franz Franchetti,,Hardware-Software Co-Design of Iterative Filter-Update Numerical Methods Using Processing-In-Memory,2025,"Proceedings of the SC '25 Workshops of the International Conference for High Performance Computing, Networking, Storage and Analysis",,,,1126,1132,,10.1145/3731599.3767489,https://doi.org/10.1145/3731599.3767489,Conference Paper,10.1145/3731599.3767489,hardware software co design of iterative filter update numerical methods using processing in memory,conference,,,0,,unclassified,conference_venue_not_matched,,,excluded,No reliable venue mapping found in ranking sources after normalization/alias pass
Wu C.; Gu Q.; Shi H.; Yao J.; Guan H.,Chenpeng Wu; Qiqi Gu; Heng Shi; Jianguo Yao; Haibing Guan,,Samoyeds: Accelerating MoE Models with Structured Sparsity Leveraging Sparse Tensor Cores,2025,Proceedings of the Twentieth European Conference on Computer Systems,,,,293,310,,10.1145/3689031.3717455,https://doi.org/10.1145/3689031.3717455,Conference Paper,10.1145/3689031.3717455,samoyeds accelerating moe models with structured sparsity leveraging sparse tensor cores,conference,,,0,,unclassified,conference_venue_not_matched,,,excluded,No reliable venue mapping found in ranking sources after normalization/alias pass
Moore J.; Deakin T.; McIntosh-Smith S.,Joseph Moore; Tom Deakin; Simon McIntosh-Smith,,AI-Assisted Design-Space Analysis of High-Performance Arm Processors,2025,"Proceedings of the SC '24 Workshops of the International Conference on High Performance Computing, Network, Storage, and Analysis",,,,1455,1467,,10.1109/SCW63240.2024.00186,https://doi.org/10.1109/SCW63240.2024.00186,Conference Paper,10.1109/scw63240.2024.00186,ai assisted design space analysis of high performance arm processors,conference,,,0,,unclassified,conference_venue_not_matched,,,excluded,No reliable venue mapping found in ranking sources after normalization/alias pass
Yu F.; Tan H.; Chen X.; Chen Y.; He B.; Wong W.,Feng Yu; Hongshi Tan; Xinyu Chen; Yao Chen; Bingsheng He; Weng-Fai Wong,,Clementi: Efficient Load Balancing and Communication Overlap for Multi-FPGA Graph Processing,2025,Proc. ACM Manag. Data,3,3,138,,,,10.1145/3725275,https://doi.org/10.1145/3725275,Journal Article,10.1145/3725275,clementi efficient load balancing and communication overlap for multi fpga graph processing,journal,,,0,,unclassified,journal_venue_not_matched,Proceedings of the ACM SIGMOD International Conference on Management of Data,,excluded,Mapped journal is not Q1/Q2 in ranking sources
Srichandan A.; Ragheb O.; Anderson J.,Aditya Srichandan; Omar Ragheb; Jason Anderson,,Systolic Array-Based Matrix Multiplication and Reduction on Elastic CGRAs,2025,Proceedings of the 15th International Symposium on Highly Efficient Accelerators and Reconfigurable Technologies,,,,67,75,,10.1145/3728179.3728196,https://doi.org/10.1145/3728179.3728196,Conference Paper,10.1145/3728179.3728196,systolic array based matrix multiplication and reduction on elastic cgras,conference,,,0,,unclassified,conference_venue_not_matched,,,excluded,No reliable venue mapping found in ranking sources after normalization/alias pass
