Authors,Author full names,Author(s) ID,Title,Year,Source title,Volume,Issue,Art. No.,Page start,Page end,Cited by,DOI,Link,Document Type,doi_norm,title_norm,venue_type_inferred,matched_venue_name,matched_by,venue_match_score,venue_classification,selection_status,selection_reason,,,,
Rana M.; Malani N.; Gajjar R.; Patel M.I.; Panchal D.,"Rana, Mihir (57220704732); Malani, Nimit (58549186500); Gajjar, Ruchi (57189214067); Patel, Manish I. (57188760171); Panchal, Dipesh (57203202477)",57220704732; 58549186500; 57189214067; 57188760171; 57203202477,Automated Design Rule Checker for VLSI Circuits Using Machine Learning,2023,Lecture Notes in Electrical Engineering,1024 LNEE,,,475,485,2,10.1007/978-981-99-0973-5_36,https://www.scopus.com/inward/record.uri?eid=2-s2.0-85168762719&doi=10.1007%2F978-981-99-0973-5_36&partnerID=40&md5=a831a63650f50ef1bd0ef30c416b64f0,Conference paper,10.1007/978-981-99-0973-5_36,automated design rule checker for vlsi circuits using machine learning,conference,,,0,,unclassified,conference_venue_not_matched,,,excluded,No reliable venue mapping found in ranking sources after normalization/alias pass
Logesh R.; Preethi S.R.; Krishna Raja S.; Kavya S.,"Logesh, R. (59570370300); Preethi, S.R. (57208740305); Krishna Raja, S. (58920210100); Kavya, S. (58919110300)",59570370300; 57208740305; 58920210100; 58919110300,FPGA driven intelligent vending solution using Xilinx Vivado,2023,"Proceedings - 1st International Conference on Intelligent Technologies for Sustainable Electric and Communications Systems, iTech SECOM 2023",,,,373,377,4,10.1109/iTechSECOM59882.2023.10435191,https://www.scopus.com/inward/record.uri?eid=2-s2.0-85186646847&doi=10.1109%2FiTechSECOM59882.2023.10435191&partnerID=40&md5=f478989bf82542bf0a7d4a562d2a1429,Conference paper,10.1109/itechsecom59882.2023.10435191,fpga driven intelligent vending solution using xilinx vivado,conference,,,0,,unclassified,conference_venue_not_matched,,,excluded,No reliable venue mapping found in ranking sources after normalization/alias pass
Shin H.; Ban Y.; Kil J.; Hwang H.; Cho K.; Shim S.; Lee B.; Shin I.; Kim H.; Jang C.,"Shin, Hosoon (56193280900); Ban, Yongchan (59824922700); Kil, Jaebok (58475162500); Hwang, Heecheol (57424580900); Cho, Kyoungin (58475877900); Shim, Sangmin (58476577200); Lee, Bonghyun (57215105443); Shin, Insub (58476577300); Kim, Heeyeon (58476110400); Jang, Chaeyoung (57638928200)",56193280900; 59824922700; 58475162500; 57424580900; 58475877900; 58476577200; 57215105443; 58476577300; 58476110400; 57638928200,Machine Learning Applications on 3nm Technology and Designs for Improving Block-Level PPA,2023,Proceedings of SPIE - The International Society for Optical Engineering,12495,,124951A,,,2,10.1117/12.2658070,https://www.scopus.com/inward/record.uri?eid=2-s2.0-85164176283&doi=10.1117%2F12.2658070&partnerID=40&md5=9c477be93cbf43a2cfd48fb87bae2f7e,Conference paper,10.1117/12.2658070,machine learning applications on 3nm technology and designs for improving block level ppa,conference,,,0,,unclassified,conference_venue_not_matched,,,excluded,No reliable venue mapping found in ranking sources after normalization/alias pass
Tulasi D.; Granados A.; Gunawardane P.; Kashyap A.; McDonald Z.; Thulasidasan S.,"Tulasi, Dhruv (58833669600); Granados, Alys (57188633785); Gunawardane, Prabath (22933969700); Kashyap, Abhay (58835294500); McDonald, Zara (57210991204); Thulasidasan, Sunil (7801643916)",58833669600; 57188633785; 22933969700; 58835294500; 57210991204; 7801643916,Smart Camera Traps: Enabling Energy-Efficient Edge-AI for Remote Monitoring of Wildlife,2023,GeoWildLife 2023 - Proceedings of the 1st ACM SIGSPATIAL International Workshop on AI-driven Spatio-temporal Data Analysis for Wildlife Conservation,,,,9,16,6,10.1145/3615893.3628760,https://www.scopus.com/inward/record.uri?eid=2-s2.0-85182939737&doi=10.1145%2F3615893.3628760&partnerID=40&md5=dd8d8697b1b1cb638b8f04d0a9fda74b,Conference paper,10.1145/3615893.3628760,smart camera traps enabling energy efficient edge ai for remote monitoring of wildlife,conference,,,0,,unclassified,conference_venue_not_matched,,,excluded,No reliable venue mapping found in ranking sources after normalization/alias pass
Maryam Abbasi; Filipe Cardoso; José Silva; Pedro Martins,Maryam Abbasi; Filipe Cardoso; José Silva; Pedro Martins,,Scalable and Energy-Efficient Deep Learning for Distributed AIoT Applications Using Modular Cognitive IoT Hardware,2023,"New Trends in Disruptive Technologies, Tech Ethics and Artificial Intelligence",,,,,,,10.1007/978-3-031-38344-1_9,https://link.springer.com/chapter/10.1007/978-3-031-38344-1_9,Conference Paper,10.1007/978-3-031-38344-1_9,scalable and energy efficient deep learning for distributed aiot applications using modular cognitive iot hardware,conference,,,0,,unclassified,conference_venue_not_matched,,,excluded,No reliable venue mapping found in ranking sources after normalization/alias pass
Pawan SharmaS. Gurunarayanan; Anupama Karuppiah,Pawan SharmaS. Gurunarayanan; Anupama Karuppiah,,A Review of Deep Learning Techniques of Chest X-ray Analysis for Thoracic Disorders,2023,Proceedings of Eighth International Congress on Information and Communication Technology,,,,,,,10.1007/978-981-99-3091-3_42,https://link.springer.com/chapter/10.1007/978-981-99-3091-3_42,Conference Paper,10.1007/978-981-99-3091-3_42,a review of deep learning techniques of chest x ray analysis for thoracic disorders,conference,,,0,,unclassified,conference_venue_not_matched,,,excluded,No reliable venue mapping found in ranking sources after normalization/alias pass
Wenji Li; Zhaojun Wang; Ruitao Mai; Pengxiang Ren; Qinchang Zhang; Yutao Zhou; Ning Xu; Jia; Fan Zhuang; Bin Xin; Liang Gao; Zhifeng Hao; Zhun Fan,Wenji Li; Zhaojun Wang; Ruitao Mai; Pengxiang Ren; Qinchang Zhang; Yutao Zhou; Ning Xu; Jia; Fan Zhuang; Bin Xin; Liang Gao; Zhifeng Hao; Zhun Fan,,"Modular design automation of the morphologies, controllers, and vision systems for intelligent robots: a survey",2023,Visual Intelligence,,,,,,,10.1007/s44267-023-00006-x,https://link.springer.com/article/10.1007/s44267-023-00006-x,Journal Article,10.1007/s44267-023-00006-x,modular design automation of the morphologies controllers and vision systems for intelligent robots a survey,journal,,,0,,unclassified,journal_venue_not_matched,,,excluded,No reliable venue mapping found in ranking sources after normalization/alias pass
Marc Rothmann; Mario Porrmann,Marc Rothmann; Mario Porrmann,,STANN – Synthesis Templates for Artificial Neural Network Inference and Training,2023,Advances in Computational Intelligence,,,,,,,10.1007/978-3-031-43085-5_31,https://link.springer.com/chapter/10.1007/978-3-031-43085-5_31,Conference Paper,10.1007/978-3-031-43085-5_31,stann synthesis templates for artificial neural network inference and training,conference,,,0,,unclassified,conference_venue_not_matched,,,excluded,No reliable venue mapping found in ranking sources after normalization/alias pass
Nhut-Minh Ho; Duy-Thanh Nguyen; John L. Gustafson; Weng-Fai Wong,Nhut-Minh Ho; Duy-Thanh Nguyen; John L. Gustafson; Weng-Fai Wong,,Bedot: Bit Efficient Dot Product for Deep Generative Models,2023,Next Generation Arithmetic,,,,,,,10.1007/978-3-031-32180-1_2,https://link.springer.com/chapter/10.1007/978-3-031-32180-1_2,Conference Paper,10.1007/978-3-031-32180-1_2,bedot bit efficient dot product for deep generative models,conference,,,0,,unclassified,conference_venue_not_matched,,,excluded,No reliable venue mapping found in ranking sources after normalization/alias pass
Bryan Martins Lima; Naiara Sachetti; Augusto Berndt; Cristina Meinhardt; Jonata Tyska Carvalho,Bryan Martins Lima; Naiara Sachetti; Augusto Berndt; Cristina Meinhardt; Jonata Tyska Carvalho,,Adaptive Batch Size CGP: Improving Accuracy and Runtime for CGP Logic Optimization Flow,2023,Genetic Programming,,,,,,,10.1007/978-3-031-29573-7_10,https://link.springer.com/chapter/10.1007/978-3-031-29573-7_10,Conference Paper,10.1007/978-3-031-29573-7_10,adaptive batch size cgp improving accuracy and runtime for cgp logic optimization flow,conference,,,0,,unclassified,conference_venue_not_matched,,,excluded,No reliable venue mapping found in ranking sources after normalization/alias pass
Jaikrishna Manojkumar Patil; Johannes Bayer; Andreas Dengel,Jaikrishna Manojkumar Patil; Johannes Bayer; Andreas Dengel,,Graph Neural Networks for Circuit Diagram Pattern Generation,2023,Deep Learning Theory and Applications,,,,,,,10.1007/978-3-031-39059-3_24,https://link.springer.com/chapter/10.1007/978-3-031-39059-3_24,Conference Paper,10.1007/978-3-031-39059-3_24,graph neural networks for circuit diagram pattern generation,conference,,,0,,unclassified,conference_venue_not_matched,,,excluded,No reliable venue mapping found in ranking sources after normalization/alias pass
Austin Davis; Surekha Paneerselvam,Austin Davis; Surekha Paneerselvam,,Design and Development of AUV for Coral Reef Inspection and Geotagging Using CV/ML,2023,Innovations in Data Analytics,,,,,,,10.1007/978-981-99-0550-8_47,https://link.springer.com/chapter/10.1007/978-981-99-0550-8_47,Conference Paper,10.1007/978-981-99-0550-8_47,design and development of auv for coral reef inspection and geotagging using cv ml,conference,,,0,,unclassified,conference_venue_not_matched,,,excluded,No reliable venue mapping found in ranking sources after normalization/alias pass
Fabian KreßJulian Hoefer; Tim Hotfilter; Iris Walter; El Mahdi El Annabi; Tanja HarbaumJürgen Becker,Fabian KreßJulian Hoefer; Tim Hotfilter; Iris Walter; El Mahdi El Annabi; Tanja HarbaumJürgen Becker,,Automated Search for Deep Neural Network Inference Partitioning on Embedded FPGA,2023,Machine Learning and Principles and Practice of Knowledge Discovery in Databases,,,,,,,10.1007/978-3-031-23618-1_37,https://link.springer.com/chapter/10.1007/978-3-031-23618-1_37,Conference Paper,10.1007/978-3-031-23618-1_37,automated search for deep neural network inference partitioning on embedded fpga,conference,,,0,,unclassified,conference_venue_not_matched,,,excluded,No reliable venue mapping found in ranking sources after normalization/alias pass
Lück C.; Lopera D.S.; Wenzek S.; Ecker W.,Christian Lück; Daniela Sánchez Lopera; Sven Wenzek; Wolfgang Ecker,,Industrial Experience with Open-Source EDA Tools,2022,Proceedings of the 2022 ACM/IEEE Workshop on Machine Learning for CAD,,,,143,143,,10.1145/3551901.3557040,https://doi.org/10.1145/3551901.3557040,Conference Paper,10.1145/3551901.3557040,industrial experience with open source eda tools,conference,,,0,,unclassified,conference_venue_not_matched,,,excluded,No reliable venue mapping found in ranking sources after normalization/alias pass
Esmaeilzadeh H.; Ghodrati S.; Kahng A.B.; Kim J.K.; Kinzer S.; Kundu S.; Mahapatra R.; Manasi S.D.; Sapatnekar S.S.; Wang Z.; Zeng Z.,Hadi Esmaeilzadeh; Soroush Ghodrati; Andrew B. Kahng; Joon Kyung Kim; Sean Kinzer; Sayak Kundu; Rohan Mahapatra; Susmita Dey Manasi; Sachin S. Sapatnekar; Zhiang Wang; Ziqing Zeng,,Physically Accurate Learning-based Performance Prediction of Hardware-accelerated ML Algorithms,2022,Proceedings of the 2022 ACM/IEEE Workshop on Machine Learning for CAD,,,,119,126,,10.1145/3551901.3556489,https://doi.org/10.1145/3551901.3556489,Conference Paper,10.1145/3551901.3556489,physically accurate learning based performance prediction of hardware accelerated ml algorithms,conference,,,0,,unclassified,conference_venue_not_matched,,,excluded,No reliable venue mapping found in ranking sources after normalization/alias pass
Shrestha P.; Phatharodom S.; Savidis I.,Pratik Shrestha; Saran Phatharodom; Ioannis Savidis,,Graph Representation Learning for Gate Arrival Time Prediction,2022,Proceedings of the 2022 ACM/IEEE Workshop on Machine Learning for CAD,,,,127,133,,10.1145/3551901.3556478,https://doi.org/10.1145/3551901.3556478,Conference Paper,10.1145/3551901.3556478,graph representation learning for gate arrival time prediction,conference,,,0,,unclassified,conference_venue_not_matched,,,excluded,No reliable venue mapping found in ranking sources after normalization/alias pass
Zhu B.; Zhang X.; Lin Y.; Yu B.; Wong M.,Binwu Zhu; Xinyun Zhang; Yibo Lin; Bei Yu; Martin Wong,,Efficient Design Rule Checking Script Generation via Key Information Extraction,2022,Proceedings of the 2022 ACM/IEEE Workshop on Machine Learning for CAD,,,,77,82,,10.1145/3551901.3556494,https://doi.org/10.1145/3551901.3556494,Conference Paper,10.1145/3551901.3556494,efficient design rule checking script generation via key information extraction,conference,,,0,,unclassified,conference_venue_not_matched,,,excluded,No reliable venue mapping found in ranking sources after normalization/alias pass
Isaev M.; McDonald N.; Young J.; Vuduc R.,"Isaev, Mikhail (57202452417); McDonald, Nic (57212198842); Young, Jeffrey (56389703800); Vuduc, Richard (8629966900)",57202452417; 57212198842; 56389703800; 8629966900,ParaGraph: An application-simulator interface and toolkit for hardware-software co-design,2022,ACM International Conference Proceeding Series,,,63,,,2,10.1145/3545008.3545069,https://www.scopus.com/inward/record.uri?eid=2-s2.0-85148638282&doi=10.1145%2F3545008.3545069&partnerID=40&md5=aaa24bac93f9b05194ff6f2da1d8b5f0,Conference paper,10.1145/3545008.3545069,paragraph an application simulator interface and toolkit for hardware software co design,conference,,,0,,unclassified,conference_venue_not_matched,,,excluded,No reliable venue mapping found in ranking sources after normalization/alias pass
Han A.; Zhao Z.; Feng C.; Zhang S.,Ao Han; Zhenyu Zhao; Chaochao Feng; Shuzheng Zhang,,Stage-based Path Delay Prediction with Customized Machine Learning Technique,2022,Proceedings of the 2021 5th International Conference on Electronic Information Technology and Computer Engineering,,,,926,933,,10.1145/3501409.3501576,https://doi.org/10.1145/3501409.3501576,Conference Paper,10.1145/3501409.3501576,stage based path delay prediction with customized machine learning technique,conference,,,0,,unclassified,conference_venue_not_matched,,,excluded,No reliable venue mapping found in ranking sources after normalization/alias pass
Lu Y.; Chan W.; Khandelwal V.; Lim S.K.,Yi-Chen Lu; Wei-Ting Chan; Vishal Khandelwal; Sung Kyu Lim,,Driving Early Physical Synthesis Exploration through End-of-Flow Total Power Prediction,2022,Proceedings of the 2022 ACM/IEEE Workshop on Machine Learning for CAD,,,,97,102,,10.1145/3551901.3556476,https://doi.org/10.1145/3551901.3556476,Conference Paper,10.1145/3551901.3556476,driving early physical synthesis exploration through end of flow total power prediction,conference,,,0,,unclassified,conference_venue_not_matched,,,excluded,No reliable venue mapping found in ranking sources after normalization/alias pass
Wu B.; Fang S.; Chang H.; Wei P.,Bing-Yue Wu; Shao-Yun Fang; Hsiang-Wen Chang; Peter Wei,,SpeedER: A Supervised Encoder-Decoder Driven Engine for Effective Resistance Estimation of Power Delivery Networks,2022,Proceedings of the 2022 ACM/IEEE Workshop on Machine Learning for CAD,,,,55,61,,10.1145/3551901.3556490,https://doi.org/10.1145/3551901.3556490,Conference Paper,10.1145/3551901.3556490,speeder a supervised encoder decoder driven engine for effective resistance estimation of power delivery networks,conference,,,0,,unclassified,conference_venue_not_matched,,,excluded,No reliable venue mapping found in ranking sources after normalization/alias pass
Ducasse Q.; Polito G.; Tesone P.; Cotret P.; Lagadec L.,Quentin Ducasse; Guillermo Polito; Pablo Tesone; Pascal Cotret; Loïc Lagadec,,Porting a JIT Compiler to RISC-V: Challenges and Opportunities,2022,Proceedings of the 19th International Conference on Managed Programming Languages and Runtimes,,,,112,118,,10.1145/3546918.3546924,https://doi.org/10.1145/3546918.3546924,Conference Paper,10.1145/3546918.3546924,porting a jit compiler to risc v challenges and opportunities,conference,,,0,,unclassified,conference_venue_not_matched,,,excluded,No reliable venue mapping found in ranking sources after normalization/alias pass
Varghese M.P.; Muthumanickam T.,"Varghese, M.P. (57993196100); Muthumanickam, T. (57226890944)",57993196100; 57226890944,Machine Learning Approaches for Electronic Design Automation in IC Design Flow,2022,"6th International Conference on I-SMAC (IoT in Social, Mobile, Analytics and Cloud), I-SMAC 2022 - Proceedings",,,,528,533,1,10.1109/I-SMAC55078.2022.9987302,https://www.scopus.com/inward/record.uri?eid=2-s2.0-85146415370&doi=10.1109%2FI-SMAC55078.2022.9987302&partnerID=40&md5=1aa89cf33306db9655eb97e826941244,Conference paper,10.1109/i-smac55078.2022.9987302,machine learning approaches for electronic design automation in ic design flow,conference,,,0,,unclassified,conference_venue_not_matched,,,excluded,No reliable venue mapping found in ranking sources after normalization/alias pass
P. Goswami; M. Shahshahani; D. Bhatia,P. Goswami; M. Shahshahani; D. Bhatia,,"MLSBench: A Benchmark Set for Machine Learning based FPGA HLS Design Flows,",2022,2022 IEEE 13th Latin America Symposium on Circuits and System (LASCAS),,,,1,4,,10.1109/LASCAS53948.2022.9789084,https://doi.org/10.1109/LASCAS53948.2022.9789084,Conference Paper,10.1109/lascas53948.2022.9789084,mlsbench a benchmark set for machine learning based fpga hls design flows,conference,,,0,,unclassified,conference_venue_not_matched,,,excluded,No reliable venue mapping found in ranking sources after normalization/alias pass
S. Kapoor; P. Agarwal; L. Kostas,S. Kapoor; P. Agarwal; L. Kostas,57391549200; 57820401000; 57850354100,"Challenges in Building Deployable Machine Learning Solutions for SoC Design,",2022,2022 IEEE Women in Technology Conference (WINTECHCON),,,,1,6,1,10.1109/WINTECHCON55229.2022.9832287,https://doi.org/10.1109/WINTECHCON55229.2022.9832287,Conference Paper,10.1109/wintechcon55229.2022.9832287,challenges in building deployable machine learning solutions for soc design,conference,,,0,,unclassified,conference_venue_not_matched,,,excluded,No reliable venue mapping found in ranking sources after normalization/alias pass
A. Malhotra; A. Singh,A. Malhotra; A. Singh,,"Implementation of AI in the field of VLSI: A Review,",2022,2022 Second International Conference on Power,,,,1,5,,10.1109/ICPC2T53885.2022.9776845,https://doi.org/10.1109/ICPC2T53885.2022.9776845,Conference Paper,10.1109/icpc2t53885.2022.9776845,implementation of ai in the field of vlsi a review,conference,,,0,,unclassified,conference_venue_not_matched,,,excluded,No reliable venue mapping found in ranking sources after normalization/alias pass
M. D. Bhavesh; N. A. Anilkumar; M. I. Patel; R. Gajjar; D. Panchal,M. D. Bhavesh; N. A. Anilkumar; M. I. Patel; R. Gajjar; D. Panchal,,"Power Consumption Prediction of Digital Circuits using Machine Learning,",2022,2022 2nd International Conference on Artificial Intelligence and Signal Processing (AISP),,,,1,6,,10.1109/AISP53593.2022.9760542,https://doi.org/10.1109/AISP53593.2022.9760542,Conference Paper,10.1109/aisp53593.2022.9760542,power consumption prediction of digital circuits using machine learning,conference,,,0,,unclassified,conference_venue_not_matched,,,excluded,No reliable venue mapping found in ranking sources after normalization/alias pass
Tumeo A.; Agostini N.B.; Curzel S.; Limaye A.; Tan C.; Amatya V.; Minutoli M.; Castellana V.G.; Li A.; Manzano J.,"Tumeo, Antonino (22036780900); Agostini, Nicolas Bohm (57211159043); Curzel, Serena (57221497406); Limaye, Ankur (7004568256); Tan, Cheng (57220963281); Amatya, Vinay (57204047227); Minutoli, Marco (56893657600); Castellana, Vito Giovanni (48760925400); Li, Ang (56654631300); Manzano, Joseph (8586510800)",22036780900; 57211159043; 57221497406; 7004568256; 57220963281; 57204047227; 56893657600; 48760925400; 56654631300; 8586510800,SO(DA)2: End-to-end Generation of Specialized Reconfigurable Architectures,2022,OpenAccess Series in Informatics,100,,1,,,4,10.4230/OASIcs.PARMA-DITAM.2022.1,https://www.scopus.com/inward/record.uri?eid=2-s2.0-85132308265&doi=10.4230%2FOASIcs.PARMA-DITAM.2022.1&partnerID=40&md5=5df7628cdd460e6e572975232a9c3bef,Conference paper,10.4230/oasics.parma-ditam.2022.1,so da 2 end to end generation of specialized reconfigurable architectures,conference,,,0,,unclassified,conference_venue_not_matched,,,excluded,No reliable venue mapping found in ranking sources after normalization/alias pass
Aaron R. Young; Narasinga Rao Miniskar; Frank Liu; Willem Blokland; Jeffrey S. Vetter,Aaron R. Young; Narasinga Rao Miniskar; Frank Liu; Willem Blokland; Jeffrey S. Vetter,,Adrastea: An Efficient FPGA Design Environment for Heterogeneous Scientific Computing and Machine Learning,2022,"Accelerating Science and Engineering Discoveries Through Integrated Research Infrastructure for Experiment, Big Data, Modeling and Simulation",,,,,,,10.1007/978-3-031-23606-8_14,https://link.springer.com/chapter/10.1007/978-3-031-23606-8_14,Conference Paper,10.1007/978-3-031-23606-8_14,adrastea an efficient fpga design environment for heterogeneous scientific computing and machine learning,conference,,,0,,unclassified,conference_venue_not_matched,,,excluded,No reliable venue mapping found in ranking sources after normalization/alias pass
Veena S. ChakravarthiS. Sowndarya; Shubham Raj,Veena S. ChakravarthiS. Sowndarya; Shubham Raj,,VLSI Design Flow Using Vinyas Design Bot,2022,ICT Analysis and Applications,,,,,,,10.1007/978-981-16-5655-2_36,https://link.springer.com/chapter/10.1007/978-981-16-5655-2_36,Conference Paper,10.1007/978-981-16-5655-2_36,vlsi design flow using vinyas design bot,conference,,,0,,unclassified,conference_venue_not_matched,,,excluded,No reliable venue mapping found in ranking sources after normalization/alias pass
Ravikant KhamitkarR. R. Dube,Ravikant KhamitkarR. R. Dube,,A Survey on Using Machine Learning to Counter Hardware Trojan Challenges,2022,ICT with Intelligent Applications,,,,,,,10.1007/978-981-16-4177-0_53,https://link.springer.com/chapter/10.1007/978-981-16-4177-0_53,Conference Paper,10.1007/978-981-16-4177-0_53,a survey on using machine learning to counter hardware trojan challenges,conference,,,0,,unclassified,conference_venue_not_matched,,,excluded,No reliable venue mapping found in ranking sources after normalization/alias pass
Malti Bansal; Priya,Malti Bansal; Priya,,Machine Learning Perspective in VLSI Computer-Aided Design at Different Abstraction Levels,2022,Mobile Computing and Sustainable Informatics,,,,,,,10.1007/978-981-16-1866-6_6,https://link.springer.com/chapter/10.1007/978-981-16-1866-6_6,Conference Paper,10.1007/978-981-16-1866-6_6,machine learning perspective in vlsi computer aided design at different abstraction levels,conference,,,0,,unclassified,conference_venue_not_matched,,,excluded,No reliable venue mapping found in ranking sources after normalization/alias pass
Sigrid Eldh,Sigrid Eldh,,On Technical Debt in Software Testing - Observations from Industry,2022,"Leveraging Applications of Formal Methods, Verification and Validation. Software Engineering",,,,,,,10.1007/978-3-031-19756-7_17,https://link.springer.com/chapter/10.1007/978-3-031-19756-7_17,Conference Paper,10.1007/978-3-031-19756-7_17,on technical debt in software testing observations from industry,conference,,,0,,unclassified,conference_venue_not_matched,,,excluded,No reliable venue mapping found in ranking sources after normalization/alias pass
Kshitiz Badola; Deepesh Sengar; Pooja Mudgil,Kshitiz Badola; Deepesh Sengar; Pooja Mudgil,,Song/Music Recommendation Using Convolutional Neural Network and Keylogger,2022,Proceedings of Data Analytics and Management,,,,,,,10.1007/978-981-16-6289-8_57,https://link.springer.com/chapter/10.1007/978-981-16-6289-8_57,Conference Paper,10.1007/978-981-16-6289-8_57,song music recommendation using convolutional neural network and keylogger,conference,,,0,,unclassified,conference_venue_not_matched,,,excluded,No reliable venue mapping found in ranking sources after normalization/alias pass
Satyashil D. NagaraleB. P. Patil,Satyashil D. NagaraleB. P. Patil,,RTL Verification and FPGA Implementation of Generalized Neural Networks: A High-Level Synthesis Approach,2022,Mobile Computing and Sustainable Informatics,,,,,,,10.1007/978-981-19-2069-1_31,https://link.springer.com/chapter/10.1007/978-981-19-2069-1_31,Conference Paper,10.1007/978-981-19-2069-1_31,rtl verification and fpga implementation of generalized neural networks a high level synthesis approach,conference,,,0,,unclassified,conference_venue_not_matched,,,excluded,No reliable venue mapping found in ranking sources after normalization/alias pass
A. E. Sathis Kumar; Babu Illuri,A. E. Sathis Kumar; Babu Illuri,,Mitigate the Side Channel Attack Using Random Generation with Reconfigurable Architecture,2022,Intelligent Computing and Networking,,,,,,,10.1007/978-981-16-4863-2_10,https://link.springer.com/chapter/10.1007/978-981-16-4863-2_10,Conference Paper,10.1007/978-981-16-4863-2_10,mitigate the side channel attack using random generation with reconfigurable architecture,conference,,,0,,unclassified,conference_venue_not_matched,,,excluded,No reliable venue mapping found in ranking sources after normalization/alias pass
Sergey Mosin,Sergey Mosin,,An Approach to Synthesis of the Neuromorphic Functional Models for Analog Components and Blocks,2022,Mesh Methods for Boundary-Value Problems and Applications,,,,,,,10.1007/978-3-030-87809-2_26,https://link.springer.com/chapter/10.1007/978-3-030-87809-2_26,Conference Paper,10.1007/978-3-030-87809-2_26,an approach to synthesis of the neuromorphic functional models for analog components and blocks,conference,,,0,,unclassified,conference_venue_not_matched,,,excluded,No reliable venue mapping found in ranking sources after normalization/alias pass
